{
  "role": "parent",
  "workflow_id": "two-binary-parent-child-restart",
  "run_id": "11111111-1111-4111-8111-111111111111",
  "events": [
    {"event_id": "1", "type": "WorkflowExecutionStarted"},
    {"event_id": "2", "type": "WorkflowTaskScheduled"},
    {"event_id": "3", "type": "WorkflowTaskStarted"},
    {"event_id": "4", "type": "WorkflowTaskCompleted"},
    {
      "event_id": "5",
      "type": "StartChildWorkflowExecutionInitiated",
      "child_workflow_id": "two-binary-parent-child-restart-child-smoke",
      "child_workflow_type": "smoke.parent_child_restart_child"
    },
    {
      "event_id": "6",
      "type": "ChildWorkflowExecutionStarted",
      "child_workflow_id": "two-binary-parent-child-restart-child-smoke",
      "child_run_id": "22222222-2222-4222-8222-222222222222",
      "child_workflow_type": "smoke.parent_child_restart_child",
      "initiated_event_id": "5"
    },
    {"event_id": "7", "type": "WorkflowTaskScheduled"},
    {"event_id": "8", "type": "WorkflowTaskStarted"},
    {"event_id": "9", "type": "WorkflowTaskCompleted"}
  ]
}
