{
  "role": "child",
  "workflow_id": "two-binary-parent-child-restart-child-smoke",
  "run_id": "22222222-2222-4222-8222-222222222222",
  "events": [
    {
      "event_id": "1",
      "type": "WorkflowExecutionStarted",
      "workflow_type": "smoke.parent_child_restart_child",
      "parent_workflow_id": "two-binary-parent-child-restart",
      "parent_run_id": "11111111-1111-4111-8111-111111111111",
      "parent_initiated_event_id": "5"
    },
    {"event_id": "2", "type": "WorkflowTaskScheduled"},
    {"event_id": "3", "type": "WorkflowTaskStarted"},
    {"event_id": "4", "type": "WorkflowTaskCompleted"},
    {"event_id": "5", "type": "TimerStarted"},
    {"event_id": "6", "type": "TimerFired"},
    {"event_id": "7", "type": "WorkflowTaskScheduled"}
  ]
}
